"source","date","assertionType","evidenceType","prefix","exactText","suffix","modality","statementType","comment","drug1Lab","drug1Type","drug1Role","dose1","drug2Lab","drug2Type","drug2Role","dose2","objectRegimens","objectFormulation","objectDuration","preciptRegimens","preciptFormulation","preciptDuration","numOfParticipants","auc","aucType","aucDirection","clearance","clearanceType","clearanceDirection","cmax","cmaxType","cmaxDirection","halflife","halflifeType","halflifeDirection"
"http://dbmi-icode-01.dbmi.pitt.edu:80/DDI-labels/a435da9d-f6e8-4ddc-897d-8cd2bf777b21.html","2015-11-05 15:42:05 -0500","DDI-clinical-trial","evidence-supports","Potential for Other Drugs to Affect WELLBUTRIN XL    ","In vitro studies indicate that bupropion is primarily metabolized to hydroxybupropion by CYP2B6. Therefore, the potential exists for drug interactions between WELLBUTRIN XL and drugs that are inhibitors or inducers of CYP2B6. In addition, in vitro studies suggest that paroxetine, sertraline, norfluoxetine, fluvoxamine, and nelfinavir, inhibit the hydroxylation of bupropion.","","ncit:positive","ncit:quantitative",,"norfluoxetine","dikbD2R:active-ingredient","dikbD2R:precipitant-drug-of-interaction","Unk","bupropion","dikbD2R:active-ingredient","dikbD2R:object-drug-of-interaction","Unk","UNK","UNK","Unk","UNK","UNK","Unk","Unk","Unk","UNK","UNK","Unk","UNK","UNK","Unk","UNK","UNK","Unk","UNK","UNK"
"http://dbmi-icode-01.dbmi.pitt.edu:80/DDI-labels/b8881a81-75d7-43e8-825f-37c352c146dc.html","2015-11-04 14:19:06 -0500","drug-drug-interaction","evidence-supports","The biochemical activity of the drug metabolizing isozyme cytochrome P450 2D6 (debrisoquine hydroxylase) is reduced in a subset of the Caucasian population (about 7% to 10% of Caucasians are so called “poor metabolizers”); reliable estimates of the prevalence of reduced P450 2D6 isozyme activity among Asian, African, and other populations are not yet available. Poor metabolizers have higher than expected plasma concentrations of tricyclic antidepressants (TCAs) when given usual doses. Depending on the fraction of drug metabolized by P450 2D6, the increase in plasma concentration may be small or quite large (8 fold increase in plasma AUC of the TCA).  ","In addition, certain drugs inhibit the activity of this isozyme and make normal metabolizers resemble poor metabolizers. An individual who is stable on a given dose of TCA may become abruptly toxic when given one of these inhibiting drugs as concomitant therapy. The drugs that inhibit cytochrome P450 2D6 include some that are not metabolized by the enzyme (quinidine; cimetidine) and many that are substrates for P450 2D6 (many other antidepressants, phenothiazines, and the Type 1C antiarrhythmics, propafenone and flecainide). While all the selective serotonin reuptake inhibitors (SSRIs), e.g., fluoxetine, sertraline, and paroxetine, inhibit P450 2D6, they may vary in the extent of inhibition. The extent to which SSRI-TCA interactions may pose clinical problems will depend on the degree of inhibition and the pharmacokinetics of the SSRI involved. Nevertheless, caution is indicated in the coadministration of TCAs with any of the SSRIs and also in switching from one class to the other. Of particular importance, sufficient time must elapse before initiating TCA treatment in a patient being withdrawn from fluoxetine, given the long half-life of the parent and active metabolite (at least 5 weeks may be necessary).","","ncit:positive","ncit:Qualitative",,"TCA","dikbD2R:drug-group","dikbD2R:object-drug-of-interaction",,"cimetidine","dikbD2R:active-ingredient","dikbD2R:precipitant-drug-of-interaction","",,,,,,,,,,,,,,,,,,,
"http://dbmi-icode-01.dbmi.pitt.edu:80/DDI-labels/a435da9d-f6e8-4ddc-897d-8cd2bf777b21.html","2015-11-05 16:13:14 -0500","DDI-clinical-trial","evidence-supports","erythrohydrobupropion decreased by 68%.  ","In another healthy volunteer study, lopinavir 400 mg/ritonavir 100 mg twice daily decreased bupropion AUC and Cmax by 57%. The AUC and Cmax of hydroxybupropion metabolite were decreased by 50% and 31%, respectively.","","ncit:positive","ncit:quantitative","Combined lopinavir/ritonavir dose","lopinavir","dikbD2R:active-ingredient","dikbD2R:precipitant-drug-of-interaction","400","bupropion","dikbD2R:active-ingredient","dikbD2R:object-drug-of-interaction","Unk","UNK","UNK","Unk","BID","Oral","Unk","Unk","57","Percent","Decrease","Unk","UNK","UNK","57","Percent","Decrease","Unk","UNK","UNK"
"http://dbmi-icode-01.dbmi.pitt.edu:80/DDI-labels/e17dc299-f52d-414d-ab6e-e809bd6f8acb.html","2015-11-04 14:14:49 -0500","drug-drug-interaction","evidence-supports","(TCAs) when given usual doses. Depending on the fraction of drug metabolized by P450 2D6, the increase in plasma concentration may be small, or quite large (8 fold increase in plasma AUC of the TCA).  ","In addition, certain drugs inhibit the activity of this isozyme and make normal metabolizers resemble poor metabolizers. An individual who is stable on a given dose of TCA may become abruptly toxic when given one of these inhibiting drugs as concomitant therapy. The drugs that inhibit cytochrome P450 2D6 include some that are not metabolized by the enzyme (quinidine; cimetidine) and many that are substrates for P450 2D6 (many other antidepressants, phenothiazines, and the Type 1C antiarrhythmics propafenone and flecainide). While all the selective serotonin reuptake inhibitors (SSRIs), e.g., fluoxetine, sertraline, and paroxetine, inhibit P450 2D6, they may vary in the extent of inhibition. The extent to which SSRI TCA interactions may pose clinical problems will depend on the degree of inhibition and the pharmacokinetics of the SSRI involved. Nevertheless, caution is indicated in the co-administration of TCAs with any of the SSRIs and also in switching from one class to the other. Of particular importance, sufficient time must elapse before initiating TCA treatment in a patient being withdrawn from fluoxetine, given the long half-life of the parent and active metabolite (at least 5 weeks may be necessary).","","ncit:positive","ncit:Qualitative",,"TCA","dikbD2R:drug-group","dikbD2R:object-drug-of-interaction","","sertraline","dikbD2R:active-ingredient","dikbD2R:precipitant-drug-of-interaction",,,,,,,,,,,,,,,,,,,,
"http://dbmi-icode-01.dbmi.pitt.edu:80/DDI-labels/0177d783-773c-41bf-9db9-eb7e5c64474a.html","2015-11-05 10:40:12 -0500","drug-drug-interaction","evidence-supports","Drugs Metabolized by P450 2D6   ","The biochemical activity of the drug metabolizing isozyme cytochrome P450 2D6 (debrisoquin hydroxylase) is reduced in a subset of the caucasian population (about 7-10% of caucasians are so called “poor metabolizers”); reliable estimates of the prevalence of reduced P450 2D6 isozyme activity among Asian, African, and other populations are not yet available. Poor metabolizers have higher than expected plasma concentrations of tricyclic antidepressants (TCAs) when given usual doses. Depending on the fraction of drug metabolized by P450 2D6, the increase in plasma concentration may be small, or quite large (8 fold increase in plasma AUC of the TCA).    In addition, certain drugs inhibit the activity of the isozyme and make normal metabolizers resemble poor metabolizers. An individual who is stable on a given dose of TCA may become abruptly toxic when given one of these inhibiting drugs as concomitant therapy. The drugs that inhibit cytochrome P450 2D6 include some that are not metabolized by the enzyme (quinidine; cimetidine) and many that are substrates for P450 2D6 (many other antidepressants, phenothiazines, and the Type 1C antiarrhythmics propafenone and flecainide). While all the selective serotonin reuptake inhibitors (SSRIs), e.g., fluoxetine, sertraline, and paroxetine, inhibit P450 2D6, they may vary in the extent of inhibition. The extent to which SSRI TCA interactions may pose clinical problems will depend on the degree of inhibition and the pharmacokinetics of the SSRI involved. Nevertheless, caution is indicated in the co-administration of TCAs with any of the SSRIs and also in switching from one class to the other. Of particular importance, sufficient time must elapse before initiating TCA treatment in a patient being withdrawn from fluoxetine, given the long half-life of the parent and active metabolite (at least 5 weeks may be necessary).    Concomitant use of tricyclic antidepressants with drugs that can inhibit cytochrome P450 2D6 may require lower doses than usually prescribed for either the tricyclic antidepressant or the other drug. Furthermore, whenever one of these other drugs is withdrawn from co-therapy, an increased dose of tricyclic antidepressant may be required. It is desirable to monitor TCA plasma levels whenever a TCA is going to be co-administered with another drug known to be an inhibitor of P450 2D6.","","ncit:positive","ncit:Qualitative",,"fluoxetine","dikbD2R:active-ingredient","dikbD2R:precipitant-drug-of-interaction",,"tricyclic antidepressants","dikbD2R:drug-group","dikbD2R:object-drug-of-interaction","",,,,,,,,,,,,,,,,,,,
"http://dbmi-icode-01.dbmi.pitt.edu:80/DDI-labels/0177d783-773c-41bf-9db9-eb7e5c64474a.html","2015-11-05 10:40:12 -0500","drug-drug-interaction","evidence-supports","Drugs Metabolized by P450 2D6   ","The biochemical activity of the drug metabolizing isozyme cytochrome P450 2D6 (debrisoquin hydroxylase) is reduced in a subset of the caucasian population (about 7-10% of caucasians are so called “poor metabolizers”); reliable estimates of the prevalence of reduced P450 2D6 isozyme activity among Asian, African, and other populations are not yet available. Poor metabolizers have higher than expected plasma concentrations of tricyclic antidepressants (TCAs) when given usual doses. Depending on the fraction of drug metabolized by P450 2D6, the increase in plasma concentration may be small, or quite large (8 fold increase in plasma AUC of the TCA).    In addition, certain drugs inhibit the activity of the isozyme and make normal metabolizers resemble poor metabolizers. An individual who is stable on a given dose of TCA may become abruptly toxic when given one of these inhibiting drugs as concomitant therapy. The drugs that inhibit cytochrome P450 2D6 include some that are not metabolized by the enzyme (quinidine; cimetidine) and many that are substrates for P450 2D6 (many other antidepressants, phenothiazines, and the Type 1C antiarrhythmics propafenone and flecainide). While all the selective serotonin reuptake inhibitors (SSRIs), e.g., fluoxetine, sertraline, and paroxetine, inhibit P450 2D6, they may vary in the extent of inhibition. The extent to which SSRI TCA interactions may pose clinical problems will depend on the degree of inhibition and the pharmacokinetics of the SSRI involved. Nevertheless, caution is indicated in the co-administration of TCAs with any of the SSRIs and also in switching from one class to the other. Of particular importance, sufficient time must elapse before initiating TCA treatment in a patient being withdrawn from fluoxetine, given the long half-life of the parent and active metabolite (at least 5 weeks may be necessary).    Concomitant use of tricyclic antidepressants with drugs that can inhibit cytochrome P450 2D6 may require lower doses than usually prescribed for either the tricyclic antidepressant or the other drug. Furthermore, whenever one of these other drugs is withdrawn from co-therapy, an increased dose of tricyclic antidepressant may be required. It is desirable to monitor TCA plasma levels whenever a TCA is going to be co-administered with another drug known to be an inhibitor of P450 2D6.","","ncit:positive","ncit:Qualitative",,"SSRIs","dikbD2R:drug-group","dikbD2R:precipitant-drug-of-interaction",,"tricyclic antidepressants","dikbD2R:drug-group","dikbD2R:object-drug-of-interaction","",,,,,,,,,,,,,,,,,,,
"http://dbmi-icode-01.dbmi.pitt.edu:80/DDI-labels/a435da9d-f6e8-4ddc-897d-8cd2bf777b21.html","2015-11-05 15:34:37 -0500","drug-drug-interaction","evidence-supports"," Drugs Metabolized by CYP2D6   ","Bupropion and its metabolites (erythrohydrobupropion, threohydrobupropion, hydroxybupropion) are CYP2D6 inhibitors. Therefore, coadministration of WELLBUTRIN XL with drugs that are metabolized by CYP2D6 can increase the exposures of drugs that are substrates of CYP2D6. Such drugs include antidepressants (e.g., venlafaxine, nortriptyline, imipramine, desipramine, paroxetine, fluoxetine, and sertraline), antipsychotics (e.g. haloperidol, risperidone, and thioridazine), beta-blockers (e.g., metoprolol), and Type 1C antiarrhythmics (e.g. propafenone, and flecainide). When used concomitantly with WELLBUTRIN XL, it may be necessary to decrease the dose of these CYP2D6 substrates, particularly for drugs with a narrow therapeutic index.","","ncit:positive","ncit:Qualitative",,"paroxetine","dikbD2R:active-ingredient","dikbD2R:object-drug-of-interaction","","Bupropion","dikbD2R:active-ingredient","dikbD2R:precipitant-drug-of-interaction",,,,,,,,,,,,,,,,,,,,
"http://dbmi-icode-01.dbmi.pitt.edu:80/DDI-labels/a435da9d-f6e8-4ddc-897d-8cd2bf777b21.html","2015-11-05 15:34:37 -0500","drug-drug-interaction","evidence-supports"," Drugs Metabolized by CYP2D6   ","Bupropion and its metabolites (erythrohydrobupropion, threohydrobupropion, hydroxybupropion) are CYP2D6 inhibitors. Therefore, coadministration of WELLBUTRIN XL with drugs that are metabolized by CYP2D6 can increase the exposures of drugs that are substrates of CYP2D6. Such drugs include antidepressants (e.g., venlafaxine, nortriptyline, imipramine, desipramine, paroxetine, fluoxetine, and sertraline), antipsychotics (e.g. haloperidol, risperidone, and thioridazine), beta-blockers (e.g., metoprolol), and Type 1C antiarrhythmics (e.g. propafenone, and flecainide). When used concomitantly with WELLBUTRIN XL, it may be necessary to decrease the dose of these CYP2D6 substrates, particularly for drugs with a narrow therapeutic index.","","ncit:positive","ncit:Qualitative",,"Bupropion","dikbD2R:active-ingredient","dikbD2R:precipitant-drug-of-interaction",,"flecainide","dikbD2R:active-ingredient","dikbD2R:object-drug-of-interaction","",,,,,,,,,,,,,,,,,,,
"http://dbmi-icode-01.dbmi.pitt.edu:80/DDI-labels/a435da9d-f6e8-4ddc-897d-8cd2bf777b21.html","2015-11-05 15:46:57 -0500","DDI-clinical-trial","evidence-supports","    Inhibitors of CYP2B6    ","Ticlopidine, Clopidogrel: In a study in healthy male volunteers, clopidogrel 75 mg once daily or ticlopidine 250 mg twice daily increased exposures (Cmax and AUC) of bupropion by 40% and 60% for clopidogrel, by 38% and 85% for ticlopidine, respectively. The exposures of hydroxybupropion were decreased. ","","ncit:positive","ncit:quantitative",,"bupropion","dikbD2R:active-ingredient","dikbD2R:object-drug-of-interaction","Unk","clopidogrel","dikbD2R:active-ingredient","dikbD2R:precipitant-drug-of-interaction","75","UNK","UNK","Unk","Daily","Oral","Unk","Unk","60","Percent","Increase","Unk","UNK","UNK","40","Percent","Increase","Unk","UNK","UNK"
"http://dbmi-icode-01.dbmi.pitt.edu:80/DDI-labels/a435da9d-f6e8-4ddc-897d-8cd2bf777b21.html","2015-11-05 15:53:54 -0500","DDI-clinical-trial","evidence-supports","and AUC values of hydroxybupropion by 32% and 24%, respectively.   ","Cimetidine: Following oral administration of bupropion 300 mg with and without cimetidine 800 mg in 24 healthy young male volunteers, the pharmacokinetics of bupropion and hydroxybupropion were unaffected. However, there were 16% and 32% increases in the AUC and Cmax, respectively, of the combined moieties of threohydrobupropion and erythrohydrobupropion.","","ncit:positive","ncit:quantitative","Combined moieties of threohydrobupropion and erythrohydrobupropion","threohydrobupropion and erythrohydrobupropion","dikbD2R:metabolite","dikbD2R:object-drug-of-interaction","Unk","bupropion","dikbD2R:active-ingredient","dikbD2R:precipitant-drug-of-interaction","800","UNK","UNK","Unk","UNK","Oral","Unk","24","16","Percent","Increase","Unk","UNK","UNK","32","Percent","Increase","Unk","UNK","UNK"
"http://dbmi-icode-01.dbmi.pitt.edu:80/DDI-labels/0177d783-773c-41bf-9db9-eb7e5c64474a.html","2015-11-05 10:40:12 -0500","drug-drug-interaction","evidence-supports","Drugs Metabolized by P450 2D6   ","The biochemical activity of the drug metabolizing isozyme cytochrome P450 2D6 (debrisoquin hydroxylase) is reduced in a subset of the caucasian population (about 7-10% of caucasians are so called “poor metabolizers”); reliable estimates of the prevalence of reduced P450 2D6 isozyme activity among Asian, African, and other populations are not yet available. Poor metabolizers have higher than expected plasma concentrations of tricyclic antidepressants (TCAs) when given usual doses. Depending on the fraction of drug metabolized by P450 2D6, the increase in plasma concentration may be small, or quite large (8 fold increase in plasma AUC of the TCA).    In addition, certain drugs inhibit the activity of the isozyme and make normal metabolizers resemble poor metabolizers. An individual who is stable on a given dose of TCA may become abruptly toxic when given one of these inhibiting drugs as concomitant therapy. The drugs that inhibit cytochrome P450 2D6 include some that are not metabolized by the enzyme (quinidine; cimetidine) and many that are substrates for P450 2D6 (many other antidepressants, phenothiazines, and the Type 1C antiarrhythmics propafenone and flecainide). While all the selective serotonin reuptake inhibitors (SSRIs), e.g., fluoxetine, sertraline, and paroxetine, inhibit P450 2D6, they may vary in the extent of inhibition. The extent to which SSRI TCA interactions may pose clinical problems will depend on the degree of inhibition and the pharmacokinetics of the SSRI involved. Nevertheless, caution is indicated in the co-administration of TCAs with any of the SSRIs and also in switching from one class to the other. Of particular importance, sufficient time must elapse before initiating TCA treatment in a patient being withdrawn from fluoxetine, given the long half-life of the parent and active metabolite (at least 5 weeks may be necessary).    Concomitant use of tricyclic antidepressants with drugs that can inhibit cytochrome P450 2D6 may require lower doses than usually prescribed for either the tricyclic antidepressant or the other drug. Furthermore, whenever one of these other drugs is withdrawn from co-therapy, an increased dose of tricyclic antidepressant may be required. It is desirable to monitor TCA plasma levels whenever a TCA is going to be co-administered with another drug known to be an inhibitor of P450 2D6.","","ncit:positive","ncit:Qualitative",,"antidepressants","dikbD2R:drug-group","dikbD2R:precipitant-drug-of-interaction",,"tricyclic antidepressants","dikbD2R:drug-group","dikbD2R:object-drug-of-interaction","",,,,,,,,,,,,,,,,,,,
"http://dbmi-icode-01.dbmi.pitt.edu:80/DDI-labels/51ff7db5-aaf9-4c3c-86e6-958ebf16b60f.html","2015-11-06 15:43:14 -0500","drug-drug-interaction","evidence-supports","Potential Terfenadine, Astemizole, Cisapride, and Pimozide Interactions   ","Terfenadine, astemizole, cisapride, and pimozide are all metabolized by the cytochrome P450 3A4 (CYP3A4) isozyme, and it has been demonstrated that ketoconazole, erythromycin, and other inhibitors of CYP3A4 can block the metabolism of these drugs, which can result in increased plasma concentrations of parent drug. Increased plasma concentrations of terfenadine, astemizole, cisapride, and pimozide are associated with QT prolongation and with rare cases of serious cardiovascular adverse events, including death, due principally to ventricular tachycardia of the torsade de pointes type. Nefazodone has been shown in vitro to be an inhibitor of CYP3A4. Consequently, it is recommended that nefazodone not be used in combination with either terfenadine, astemizole, cisapride, or pimozide (see CONTRAINDICATIONS and PRECAUTIONS).","","ncit:positive","ncit:Qualitative",,"nefazodone","dikbD2R:active-ingredient","dikbD2R:precipitant-drug-of-interaction",,"terfenadine","dikbD2R:active-ingredient","dikbD2R:object-drug-of-interaction","",,,,,,,,,,,,,,,,,,,
"http://dbmi-icode-01.dbmi.pitt.edu:80/DDI-labels/a435da9d-f6e8-4ddc-897d-8cd2bf777b21.html","2015-11-05 15:46:57 -0500","DDI-clinical-trial","evidence-supports","    Inhibitors of CYP2B6    ","Ticlopidine, Clopidogrel: In a study in healthy male volunteers, clopidogrel 75 mg once daily or ticlopidine 250 mg twice daily increased exposures (Cmax and AUC) of bupropion by 40% and 60% for clopidogrel, by 38% and 85% for ticlopidine, respectively. The exposures of hydroxybupropion were decreased. ","","ncit:positive","ncit:quantitative",,"ticlopidine","dikbD2R:active-ingredient","dikbD2R:precipitant-drug-of-interaction","250","bupropion","dikbD2R:active-ingredient","dikbD2R:object-drug-of-interaction","Unk","UNK","UNK","Unk","BID","Oral","Unk","Unk","85","Percent","Increase","Unk","UNK","UNK","38","Percent","Increase","Unk","UNK","UNK"
"http://dbmi-icode-01.dbmi.pitt.edu:80/DDI-labels/a435da9d-f6e8-4ddc-897d-8cd2bf777b21.html","2015-11-05 15:34:37 -0500","drug-drug-interaction","evidence-supports"," Drugs Metabolized by CYP2D6   ","Bupropion and its metabolites (erythrohydrobupropion, threohydrobupropion, hydroxybupropion) are CYP2D6 inhibitors. Therefore, coadministration of WELLBUTRIN XL with drugs that are metabolized by CYP2D6 can increase the exposures of drugs that are substrates of CYP2D6. Such drugs include antidepressants (e.g., venlafaxine, nortriptyline, imipramine, desipramine, paroxetine, fluoxetine, and sertraline), antipsychotics (e.g. haloperidol, risperidone, and thioridazine), beta-blockers (e.g., metoprolol), and Type 1C antiarrhythmics (e.g. propafenone, and flecainide). When used concomitantly with WELLBUTRIN XL, it may be necessary to decrease the dose of these CYP2D6 substrates, particularly for drugs with a narrow therapeutic index.","","ncit:positive","ncit:Qualitative",,"Bupropion","dikbD2R:active-ingredient","dikbD2R:precipitant-drug-of-interaction",,"antidepressants","dikbD2R:drug-group","dikbD2R:object-drug-of-interaction","",,,,,,,,,,,,,,,,,,,
"http://dbmi-icode-01.dbmi.pitt.edu:80/DDI-labels/53664f8d-3a93-9f2b-daee-380707e4062c.html","2015-10-27 15:29:30 -0400","DDI-clinical-trial","evidence-supports","    Ramelteon   ","When fluvoxamine 100 mg twice daily was administered for 3 days prior to single-dose coadministration of ramelteon 16 mg and fluvoxamine, the AUC for ramelteon increased approximately 190-fold and the Cmax increased approximately 70-fold compared to ramelteon administered alone. Ramelteon should not be used in combination with fluvoxamine. ","","ncit:positive","ncit:quantitative",,"fluvoxamine","dikbD2R:active-ingredient","dikbD2R:precipitant-drug-of-interaction","100","ramelteon","dikbD2R:active-ingredient","dikbD2R:object-drug-of-interaction","16","SD","Oral","1","BID","Oral","3","Unk","190","Fold","Increase","Unk","UNK","UNK","70","Fold","Increase","Unk","UNK","UNK"
"http://dbmi-icode-01.dbmi.pitt.edu:80/DDI-labels/a435da9d-f6e8-4ddc-897d-8cd2bf777b21.html","2015-11-05 15:34:37 -0500","drug-drug-interaction","evidence-supports"," Drugs Metabolized by CYP2D6   ","Bupropion and its metabolites (erythrohydrobupropion, threohydrobupropion, hydroxybupropion) are CYP2D6 inhibitors. Therefore, coadministration of WELLBUTRIN XL with drugs that are metabolized by CYP2D6 can increase the exposures of drugs that are substrates of CYP2D6. Such drugs include antidepressants (e.g., venlafaxine, nortriptyline, imipramine, desipramine, paroxetine, fluoxetine, and sertraline), antipsychotics (e.g. haloperidol, risperidone, and thioridazine), beta-blockers (e.g., metoprolol), and Type 1C antiarrhythmics (e.g. propafenone, and flecainide). When used concomitantly with WELLBUTRIN XL, it may be necessary to decrease the dose of these CYP2D6 substrates, particularly for drugs with a narrow therapeutic index.","","ncit:positive","ncit:Qualitative",,"Bupropion","dikbD2R:active-ingredient","dikbD2R:precipitant-drug-of-interaction",,"antipsychotics","dikbD2R:drug-group","dikbD2R:object-drug-of-interaction","",,,,,,,,,,,,,,,,,,,
