"source","date","assertionType","evidenceType","prefix","exactText","suffix","modality","statementType","comment","drug1Lab","drug1Type","drug1Role","dose1","drug2Lab","drug2Type","drug2Role","dose2","objectRegimens","objectFormulation","objectDuration","preciptRegimens","preciptFormulation","preciptDuration","numOfParticipants","auc","aucType","aucDirection","clearance","clearanceType","clearanceDirection","cmax","cmaxType","cmaxDirection","halflife","halflifeType","halflifeDirection"
"http://dbmi-icode-01.dbmi.pitt.edu:80/DDI-labels/4650d12c-b9c8-4525-b07f-a2d773eca155.html","2015-08-20 11:48:50 -0400","drug-drug-interaction","evidence-supports","nsporter 3 (OAT3) substrates   ","Teriflunomide inhibits the activity of OAT3 in vivo. In patients taking AUBAGIO, exposure of drugs which are OAT3 substrates (e.g., cefaclor, cimetidine, ciprofloxacin, penicillin G, ketoprofen, furosemide, methotrexate, zidovudine) may be increased. Monitor these patients and adjust the dose of the concomitant drug(s) which are OAT3 substrates as required [see Clinical Pharmacology (12.3)].","","ncit:positive","ncit:Qualitative",,"furosemide","dikbD2R:active-ingredient","dikbD2R:object-drug-of-interaction","","Teriflunomide","dikbD2R:active-ingredient","dikbD2R:precipitant-drug-of-interaction","","","","","","","","","","","","","","","","","","","",""
"http://dbmi-icode-01.dbmi.pitt.edu:80/DDI-labels/ea35caf8-c8c8-481a-97a2-25f68cbc240b.html","2015-10-29 11:09:04 -0400","drug-drug-interaction","evidence-supports","e in plasma AUC of the TCA ).  ","In addition, certain drugs inhibit the activity of this isozyme and make normal metabolizers resemble poor metabolizers. An individual who is stable on a given dose of TCA may become abruptly toxic when given one of these inhibiting drugs as concomitant therapy. The drugs that inhibit cytochrome P450 2D6 include some that are not metabolized by the enzyme (quinidine; cimetidine) and many that are substrates for P450 2D6 (many other antidepressants, phenothiazines, and the Type 1C antiarrhythmics propafenone and flecainide). While all the selective serotonin reuptake inhibitors (SSRIs), e.g., fluoxetine, sertraline, and paroxetine, inhibit P450 2D6, they may vary in the extent of inhibition. The extent to which SSRI-TCA interactions may pose clinical problems will depend on the degree of inhibition and the pharmacokinetics of the SSRI involved. Nevertheless, caution is indicated in the coadministration of TCAs with any of the SSRIs and also in switching from one class to the other. Of particular importance, sufficient time must elapse before initiating TCA treatment in a patient being withdrawn from fluoxetine, given the long half-life of the parent and active metabolite (at least 5 weeks may be necessary).","","ncit:positive","ncit:Qualitative",,"TCA","dikbD2R:drug-group","dikbD2R:object-drug-of-interaction",,"quinidine","dikbD2R:active-ingredient","dikbD2R:precipitant-drug-of-interaction","",,,,,,,,,,,,,,,,,,,
"http://dbmi-icode-01.dbmi.pitt.edu:80/DDI-labels/75bf3473-2d70-4d41-93cd-afa1015e45bb.html","2015-10-01 10:49:57 -0400","drug-drug-interaction","evidence-supports","se in plasma AUC of the TCA).  ","In addition, certain drugs inhibit the activity of this isozyme and make normal metabolizers resemble poor metabolizers. An individual who is stable on a given dose of TCA may become abruptly toxic when given one of these inhibiting drugs as concomitant therapy. The drugs that inhibit cytochrome P450 2D6 include some that are not metabolized by the enzyme (quinidine; cimetidine) and many that are substrates for P450 2D6 (many other antidepressants, phenothiazines, and the Type 1C antiarrhythmics propafenone and flecainide). While all the selective serotonin reuptake inhibitors (SSRIs), e.g., fluoxetine, sertraline, and paroxetine, inhibit P450 2D6, they may vary in the extent of inhibition. The extent to which SSRI-TCA interactions may pose clinical problems will depend on the degree of inhibition and the pharmacokinetics of the SSRI involved. Nevertheless, caution is indicated in the co-administration of TCAs with any of the SSRIs and also in switching from one class to the other. Of particular importance, sufficient time must elapse before initiating TCA treatment in a patient being withdrawn from fluoxetine, given the long half-life of the parent and active metabolite (at least 5 weeks may be necessary).","","ncit:positive","ncit:Qualitative",,"TCA","dikbD2R:drug-group","dikbD2R:object-drug-of-interaction","","fluoxetine","dikbD2R:active-ingredient","dikbD2R:precipitant-drug-of-interaction","","","","","","","","","","","","","","","","","","","",""
"http://dbmi-icode-01.dbmi.pitt.edu:80/DDI-labels/b891bd9f-fdb8-4862-89c5-ecdd700398a3.html","2015-09-03 15:42:22 -0400","drug-drug-interaction","evidence-supports","nical Pharmacology (12.3) ] .  ","No dose adjustment of alprazolam, ibuprofen, levothyroxine, olanzapine, risperdione, warfarin, or strong CYP3A4 inhibitors (e.g., ketoconazole) is necessary when these drugs are used in combination with EMSAM. EMSAM had no clinically relevant effect on pharmacokinetics of these drugs.","","ncit:negative","ncit:Qualitative",,"olanzapine","dikbD2R:active-ingredient","dikbD2R:object-drug-of-interaction","","EMSAM","dikbD2R:drug-product","dikbD2R:precipitant-drug-of-interaction","","","","","","","","","","","","","","","","","","","",""
"http://dbmi-icode-01.dbmi.pitt.edu:80/DDI-labels/b891bd9f-fdb8-4862-89c5-ecdd700398a3.html","2015-10-27 14:17:34 -0400","DDI-clinical-trial","evidence-supports","","Risperidone    In subjects who had received EMSAM 6 mg per 24 hours for 10 days, co-administration with risperidone (2 mg per day for 7 days), a substrate for CYP2D6, did not affect the pharmacokinetics of selegiline or risperidone [see Drug Interactions (7.4) and (7.5)].    Warfarin","","ncit:negative","ncit:quantitative",,"EMSAM","dikbD2R:drug-product","dikbD2R:precipitant-drug-of-interaction","6","risperidone","dikbD2R:active-ingredient","dikbD2R:object-drug-of-interaction","2","Daily","Oral","7","Daily","transdermal","10","Unk","Unk","UNK","UNK","Unk","UNK","UNK","Unk","UNK","UNK","Unk","UNK","UNK"
"http://dbmi-icode-01.dbmi.pitt.edu:80/DDI-labels/4e338e89-3cf2-48eb-b6e2-a06c608c6513.html","2015-08-20 11:17:13 -0400","DDI-clinical-trial","evidence-supports","CYP2C9, CYP2C19 and CYP3A4/5.  ","In an in vivo drug-drug interaction trial, the Cmax and AUC of dextromethorphan (CYP2D6 substrate) were increased 2.8- and 2.9-fold, respectively when dextromethorphan 30 mg was given with abiraterone acetate 1,000 mg daily (plus prednisone 5 mg twice daily). The AUC for dextrorphan, the active metabolite of dextromethorphan, increased approximately 1.3 fold [see Drug Interactions (7.2)].","","ncit:positive","ncit:quantitative",,"dextromethorphan","dikbD2R:active-ingredient","dikbD2R:object-drug-of-interaction","1000","abiraterone acetate","dikbD2R:active-ingredient","dikbD2R:precipitant-drug-of-interaction","30","UNK","UNK","Unk","Daily","UNK","Unk","Unk","2.9","Fold","Increase","Unk","UNK","UNK","2.8","Fold","Increase","Unk","UNK","UNK"
"http://dbmi-icode-01.dbmi.pitt.edu:80/DDI-labels/5f356c1b-96bd-4ef1-960c-91cf4905e6b1.html","2015-11-02 16:13:06 -0500","DDI-clinical-trial","evidence-supports","","Olanzapine — Fluoxetine (60 mg single dose or 60 mg daily dose for 8 days) causes a small (mean 16%) increase in the maximum concentration of olanzapine and a small (mean 16%) decrease in olanzapine clearance. The magnitude of the impact of this factor is small in comparison to the overall variability between individuals, and therefore dose modification is not routinely recommended. ","","ncit:positive","ncit:quantitative",,"olanzapine","dikbD2R:active-ingredient","dikbD2R:object-drug-of-interaction","Unk","Fluoxetine","dikbD2R:active-ingredient","dikbD2R:precipitant-drug-of-interaction","60","UNK","UNK","Unk","Daily","Oral","8","Unk","Unk","UNK","UNK","16","Percent","Decrease","16","Percent","Increase","Unk","UNK","UNK"
"http://dbmi-icode-01.dbmi.pitt.edu:80/DDI-labels/326e8ab0-6886-4749-9544-885b37070051.html","2015-09-14 11:21:10 -0400","drug-drug-interaction","evidence-supports","","An in vivo interaction study involving the coadministration under steady-state conditions of paroxetine and terfenadine, a substrate for cytochrome CYP3A4, revealed no effect of paroxetine on terfenadine pharmacokinetics."," In addition,","ncit:negative","ncit:Qualitative",,"paroxetine","dikbD2R:active-ingredient","dikbD2R:precipitant-drug-of-interaction","","terfenadine","dikbD2R:active-ingredient","dikbD2R:object-drug-of-interaction","","","","","","","","","","","","","","","","","","","",""
"http://dbmi-icode-01.dbmi.pitt.edu:80/DDI-labels/cc9e1c8c-0e2b-44e2-878b-27057f786be9.html","2015-08-20 13:57:35 -0400","drug-drug-interaction","evidence-supports","beta blockers or diltiazem )   ","Experience with GILENYA in patients receiving concurrent therapy with drugs that slow the heart rate or atrioventricular conduction (e.g., beta blockers, digoxin, or heart rate-slowing calcium channel blockers such as diltiazem or verapamil) is limited. Because initiation of GILENYA treatment may result in an additional decrease in heart rate, concomitant use of these drugs during GILENYA initiation may be associated with severe bradycardia or heart block. Seek advice from the prescribing physician regarding the possibility to switch to drugs that do not slow the heart rate or atrioventricular conduction before initiating GILENYA. Patients who cannot switch, should have overnight continuous ECG monitoring after the first dose [see Dosage and Administration (2) and Warnings and Precautions (5.1)]","","ncit:positive","ncit:Qualitative",,"beta blockers","dikbD2R:drug-group","dikbD2R:object-drug-of-interaction","","GILENYA","dikbD2R:drug-product","dikbD2R:precipitant-drug-of-interaction","","","","","","","","","","","","","","","","","","","",""
"http://dbmi-icode-01.dbmi.pitt.edu:80/DDI-labels/c25f968b-7037-4f60-9a02-2189769b0cbf.html","2015-10-28 16:46:43 -0400","DDI-clinical-trial","evidence-supports","ocking ability of atenolol .   ","Digoxin–In a placebo-controlled trial in normal volunteers, administration of sertraline for 17 days (including 200 mg/day for the last 10 days) did not change serum digoxin levels or digoxin renal clearance.","","ncit:negative","ncit:quantitative",,"digoxin","dikbD2R:active-ingredient","dikbD2R:object-drug-of-interaction","Unk","sertraline","dikbD2R:active-ingredient","dikbD2R:precipitant-drug-of-interaction","200","UNK","UNK","Unk","Daily","Oral","17","10","Unk","UNK","UNK","Unk","UNK","UNK","Unk","UNK","UNK","Unk","UNK","UNK"
"http://dbmi-icode-01.dbmi.pitt.edu:80/DDI-labels/4259d9b1-de34-43a4-85a8-41dd214e9177.html","2015-11-02 13:32:33 -0500","DDI-clinical-trial","evidence-supports","","Digoxin - In subjects who had received 21 days of 40 mg/day Celexa, combined administration of Celexa and digoxin (single dose of 1 mg) did not significantly affect the pharmacokinetics of either citalopram or digoxin.","","ncit:negative","ncit:quantitative",,"citalopram","dikbD2R:active-ingredient","dikbD2R:object-drug-of-interaction","40","digoxin","dikbD2R:active-ingredient","dikbD2R:precipitant-drug-of-interaction","1","Daily","Oral","21","SD","Oral","1","Unk","Unk","UNK","UNK","Unk","UNK","UNK","Unk","UNK","UNK","Unk","UNK","UNK"
"http://dbmi-icode-01.dbmi.pitt.edu:80/DDI-labels/1809bcb4-5fcc-45ca-986a-4fa5edcd4b5e.html","2015-09-29 09:58:27 -0400","drug-drug-interaction","evidence-supports","er tricyclic antidepressants.  ","The plasma concentration of CMI has been reported to be increased by the concomitant administration of haloperidol; plasma levels of several closely related tricyclic antidepressants have been reported to be increased by the concomitant administration of methylphenidate or hepatic enzyme inhibitors (e.g., cimetidine, fluoxetine) and decreased by the concomitant administration of hepatic enzyme inducers (e.g., barbiturates, phenytoin), and such an effect may be anticipated with CMI as well. Administration of CMI has been reported to increase the plasma levels of phenobarbital, if given concomitantly (see CLINICAL PHARMACOLOGY, Interactions).","","ncit:positive","ncit:Qualitative",,"tricyclic antidepressants","dikbD2R:drug-group","dikbD2R:object-drug-of-interaction","","hepatic enzyme inducers","dikbD2R:drug-group","dikbD2R:precipitant-drug-of-interaction","","","","","","","","","","","","","","","","","","","",""
"http://dbmi-icode-01.dbmi.pitt.edu:80/DDI-labels/c25f968b-7037-4f60-9a02-2189769b0cbf.html","2015-10-28 16:36:27 -0400","DDI-clinical-trial","evidence-supports"," of these changes is unknown.  ","In a placebo-controlled trial in normal volunteers, the administration of two doses of sertraline did not significantly alter steady-state lithium levels or the renal clearance of lithium.","","ncit:negative","ncit:quantitative",,"sertraline","dikbD2R:active-ingredient","dikbD2R:precipitant-drug-of-interaction","Unk","lithium","dikbD2R:active-ingredient","dikbD2R:object-drug-of-interaction","Unk","UNK","UNK","Unk","UNK","UNK","Unk","Unk","Unk","UNK","UNK","Unk","UNK","UNK","Unk","UNK","UNK","Unk","UNK","UNK"
"http://dbmi-icode-01.dbmi.pitt.edu:80/DDI-labels/16a4a314-f97e-4e91-95e9-576a3773d284.html","2015-09-30 10:48:18 -0400","DDI-clinical-trial","evidence-supports","pharmacokinetics of lithium .  ","Lorazepam-There was no pharmacokinetic interaction between a single dose of Savella (50 mg) and lorazepam (1.5 mg). ","","ncit:negative","ncit:quantitative",,"lorazepam","dikbD2R:active-ingredient","dikbD2R:precipitant-drug-of-interaction","50","Savella","dikbD2R:drug-product","dikbD2R:object-drug-of-interaction","1.5","SD","tablet","1","SD","tablet","1","Unk","Unk","UNK","UNK","Unk","UNK","UNK","Unk","UNK","UNK","Unk","UNK","UNK"
"http://dbmi-icode-01.dbmi.pitt.edu:80/DDI-labels/326e8ab0-6886-4749-9544-885b37070051.html","2015-10-28 14:38:28 -0400","DDI-clinical-trial","evidence-supports",").  Drug-Drug Interactions    ","In vitro drug interaction studies reveal that paroxetine inhibits CYP2D6. Clinical drug interaction studies have been performed with substrates of CYP2D6 and show that paroxetine can inhibit the metabolism of drugs metabolized by CYP2D6 including desipramine, risperidone, and atomoxetine (see PRECAUTIONS: Drug Interactions)","","ncit:positive","ncit:quantitative",,"paroxetine","dikbD2R:active-ingredient","dikbD2R:precipitant-drug-of-interaction","Unk","atomoxetine","dikbD2R:active-ingredient","dikbD2R:object-drug-of-interaction","Unk","UNK","UNK","Unk","UNK","UNK","Unk","Unk","Unk","UNK","UNK","Unk","UNK","UNK","Unk","UNK","UNK","Unk","UNK","UNK"
"http://dbmi-icode-01.dbmi.pitt.edu:80/DDI-labels/75bf3473-2d70-4d41-93cd-afa1015e45bb.html","2015-10-01 10:49:57 -0400","drug-drug-interaction","evidence-supports","","In addition, certain drugs inhibit the activity of this isozyme and make normal metabolizers resemble poor metabolizers. An individual who is stable on a given dose of TCA may become abruptly toxic when given one of these inhibiting drugs as concomitant therapy. The drugs that inhibit cytochrome P450 2D6 include some that are not metabolized by the enzyme (quinidine; cimetidine) and many that are substrates for P450 2D6 (many other antidepressants, phenothiazines, and the Type 1C antiarrhythmics propafenone and flecainide). While all the selective serotonin reuptake inhibitors (SSRIs), e.g., fluoxetine, sertraline, and paroxetine, inhibit P450 2D6, they may vary in the extent of inhibition. The extent to which SSRI-TCA interactions may pose clinical problems will depend on the degree of inhibition and the pharmacokinetics of the SSRI involved. Nevertheless, caution is indicated in the co-administration of TCAs with any of the SSRIs and also in switching from one class to the other. Of particular importance, sufficient time must elapse before initiating TCA treatment in a patient being withdrawn from fluoxetine, given the long half-life of the parent and active metabolite (at least 5 weeks may be necessary",")","ncit:positive","ncit:Qualitative",,"flecainide","dikbD2R:active-ingredient","dikbD2R:precipitant-drug-of-interaction","","TCA","dikbD2R:drug-group","dikbD2R:object-drug-of-interaction","","","","","","","","","","","","","","","","","","","",""
"http://dbmi-icode-01.dbmi.pitt.edu:80/DDI-labels/326e8ab0-6886-4749-9544-885b37070051.html","2015-10-28 15:23:31 -0400","DDI-clinical-trial","evidence-supports","IONS and WARNINGS .  Pimozide  ","In a controlled study of healthy volunteers, after paroxetine was titrated to 60 mg daily, coadministration of a single dose of 2 mg pimozide was associated with mean increases in pimozide AUC of 151% and Cmax of 62%, compared to pimozide administered alone. The increase in pimozide AUC and Cmax is due to the CYP2D6 inhibitory properties of paroxetine. Due to the narrow therapeutic index of pimozide and its known ability to prolong the QT interval, concomitant use of pimozide and paroxetine is contraindicated (see CONTRAINDICATIONS).","","ncit:positive","ncit:quantitative",,"pimozide","dikbD2R:active-ingredient","dikbD2R:object-drug-of-interaction","2","paroxetine","dikbD2R:active-ingredient","dikbD2R:precipitant-drug-of-interaction","60","SD","Oral","1","Daily","Oral","Unk","Unk","151","Percent","Increase","Unk","UNK","UNK","62","Percent","Increase","Unk","UNK","UNK"
"http://dbmi-icode-01.dbmi.pitt.edu:80/DDI-labels/4259d9b1-de34-43a4-85a8-41dd214e9177.html","2015-11-02 13:56:21 -0500","DDI-clinical-trial","evidence-supports","","Carbamazepine - Combined administration of Celexa (40 mg/day for 14 days) and carbamazepine (titrated to 400 mg/day for 35 days) did not significantly affect the pharmacokinetics of carbamazepine, a CYP3A4 substrate. Although trough citalopram plasma levels were unaffected, given the enzyme-inducing properties of carbamazepine, the possibility that carbamazepine might increase the clearance of citalopram should be considered if the two drugs are coadministered.","","ncit:negative","ncit:quantitative",,"Celexa","dikbD2R:drug-product","dikbD2R:precipitant-drug-of-interaction","40","carbamazepine","dikbD2R:active-ingredient","dikbD2R:object-drug-of-interaction","400","Daily","Oral","35","Daily","Oral","14","Unk","Unk","UNK","UNK","Unk","UNK","UNK","Unk","UNK","UNK","Unk","UNK","UNK"
"http://dbmi-icode-01.dbmi.pitt.edu:80/DDI-labels/55816042-946d-4bec-9461-bd998628ff45.html","2015-10-14 11:57:06 -0400","drug-drug-interaction","evidence-supports","tantly administered rifampin.  ","Rifampin has been reported to substantially decrease the plasma concentrations of the following antiviral drugs: atazanavir, darunavir, fosamprenavir, saquinavir, and tipranavir. These antiviral drugs must not be co-administered with rifampin. (See CONTRAINDICATIONS.) ","","ncit:positive","ncit:Qualitative",,"Rifampin","dikbD2R:active-ingredient","dikbD2R:precipitant-drug-of-interaction","","tipranavir","dikbD2R:active-ingredient","dikbD2R:object-drug-of-interaction","","","","","","","","","","","","","","","","","","","",""
"http://dbmi-icode-01.dbmi.pitt.edu:80/DDI-labels/b891bd9f-fdb8-4862-89c5-ecdd700398a3.html","2015-10-27 14:13:01 -0400","DDI-clinical-trial","evidence-supports","","Ketoconazole    Seven-day treatment with ketoconazole (200 mg per day), a potent inhibitor of CYP3A4, did not affect the steady-state pharmacokinetics of selegiline in subjects who received EMSAM 6 mg per 24 hours for 7 days and no differences in the pharmacokinetics of ketoconazole were observed [see Drug Interactions (7.4) and (7.5)]. ","","ncit:negative","ncit:quantitative",,"selegiline","dikbD2R:active-ingredient","dikbD2R:precipitant-drug-of-interaction","6","ketoconazole","dikbD2R:active-ingredient","dikbD2R:object-drug-of-interaction","200","Daily","Oral","7","Daily","transdermal","7","Unk","Unk","UNK","UNK","Unk","UNK","UNK","Unk","UNK","UNK","Unk","UNK","UNK"
"http://dbmi-icode-01.dbmi.pitt.edu:80/DDI-labels/326e8ab0-6886-4749-9544-885b37070051.html","2015-09-14 11:32:07 -0400","drug-drug-interaction","evidence-supports","d.  Fosamprenavir / Ritonavir  ","Coadministration of fosamprenavir/ritonavir with paroxetine significantly decreased plasma levels of paroxetine. Any dose adjustment should be guided by clinical effect (tolerability and efficacy)","","ncit:positive","ncit:Qualitative",,"paroxetine","dikbD2R:active-ingredient","dikbD2R:object-drug-of-interaction","","fosamprenavir","dikbD2R:active-ingredient","dikbD2R:precipitant-drug-of-interaction","","","","","","","","","","","","","","","","","","","",""
"http://dbmi-icode-01.dbmi.pitt.edu:80/DDI-labels/13bb8267-1cab-43e5-acae-55a4d957630a.html","2015-11-02 14:22:34 -0500","DDI-clinical-trial","evidence-supports","   7.8 Digoxin   ","In subjects who had received 21 days of 40 mg/day racemic citalopram, combined administration of citalopram and digoxin (single dose of 1 mg) did not significantly affect the pharmacokinetics of either citalopram or digoxin. ","","ncit:negative","ncit:quantitative",,"digoxin","dikbD2R:active-ingredient","dikbD2R:object-drug-of-interaction","1","citalopram","dikbD2R:active-ingredient","dikbD2R:precipitant-drug-of-interaction","40","SD","Oral","1","Daily","Oral","21","Unk","Unk","UNK","UNK","Unk","UNK","UNK","Unk","UNK","UNK","Unk","UNK","UNK"
"http://dbmi-icode-01.dbmi.pitt.edu:80/DDI-labels/5f356c1b-96bd-4ef1-960c-91cf4905e6b1.html","2015-09-10 14:36:47 -0400","drug-drug-interaction","evidence-supports","","Antipsychotics — Some clinical data suggests a possible pharmacodynamic and/or pharmacokinetic interaction between SSRIs and antipsychotics. Elevation of blood levels of haloperidol and clozapine has been observed in patients receiving concomitant fluoxetine. ","","ncit:positive","ncit:Qualitative",,"fluoxetine","dikbD2R:active-ingredient","dikbD2R:precipitant-drug-of-interaction","","haloperidol","dikbD2R:active-ingredient","dikbD2R:object-drug-of-interaction","","","","","","","","","","","","","","","","","","","",""
"http://dbmi-icode-01.dbmi.pitt.edu:80/DDI-labels/a16297df-3158-48db-85e5-5cd506885556.html","2015-09-29 09:27:10 -0400","drug-drug-interaction","evidence-supports","se in plasma AUC of the TCA).  ","In addition, certain drugs inhibit the activity of this isozyme and make normal metabolizers resemble poor metabolizers. An individual who is stable on a given dose of TCA may become abruptly toxic when given one of these inhibiting drugs as concomitant therapy. The drugs that inhibit cytochrome P450 2D6 include some that are not metabolized by the enzyme (quinidine, cimetidine) and many that are substrates for P450 2D6 (many other antidepressants, phenothiazines, and the Type 1C antiarrhythmics propafenone and flecainide). While all the selective serotonin reuptake inhibitors (SSRIs), e.g., fluoxetine, sertraline, and paroxetine, inhibit P450 2D6, they may vary in the extent of inhibition. The extent to which SSRI-TCA interactions may pose clinical problems will depend on the degree of inhibition and the pharmacokinetics of the SSRI involved. Nevertheless, caution is indicated in the co-administration of TCAs with any of the SSRIs and also in switching from one class to the other. Of particular importance, sufficient time must elapse before initiating TCA treatment in a patient being withdrawn from fluoxetine, given the long half-life of the parent and active metabolite (at least 5 weeks may be necessary).","","ncit:positive","ncit:Qualitative",,"quinidine","dikbD2R:active-ingredient","dikbD2R:precipitant-drug-of-interaction","","TCA","dikbD2R:drug-group","dikbD2R:object-drug-of-interaction","","","","","","","","","","","","","","","","","","","",""
"http://dbmi-icode-01.dbmi.pitt.edu:80/DDI-labels/53664f8d-3a93-9f2b-daee-380707e4062c.html","2015-09-10 15:01:13 -0400","drug-drug-interaction","evidence-supports","yclic Antidepressants (TCAs)   ","Significantly increased plasma TCA levels have been reported with the coadministration of fluvoxamine maleate and amitriptyline, clomipramine or imipramine. Caution is indicated with the coadministration of fluvoxamine maleate tablets and TCAs; plasma TCA concentrations may need to be monitored, and the dose of TCA may need to be reduced.","","ncit:positive","ncit:Qualitative",,"fluvoxamine maleate","dikbD2R:active-ingredient","dikbD2R:precipitant-drug-of-interaction","","imipramine","dikbD2R:active-ingredient","dikbD2R:object-drug-of-interaction","","","","","","","","","","","","","","","","","","","",""
